{"status":"failed","provider":"OpenAI","model":"GPT-5 Codex","board_id":"p4_09_nrf52840_dk","probe_uid":"683377322","serial_id":"000683377322","artifact_paths":{"elf":"C:\\Users\\Jason\\Documents\\Jason\\FirmCLI\\BYO-Server\\.agent-workspace\\p4-09-fresh-nrf52840dk-20260717\\collected-general-final\\firmware.elf","hex":"C:\\Users\\Jason\\Documents\\Jason\\FirmCLI\\BYO-Server\\.agent-workspace\\p4-09-fresh-nrf52840dk-20260717\\collected-general-final\\firmware.hex","map":"C:\\Users\\Jason\\Documents\\Jason\\FirmCLI\\BYO-Server\\.agent-workspace\\p4-09-fresh-nrf52840dk-20260717\\collected-general-final\\firmware.map"},"artifact_hashes":{"elf":"557eb46e64a2793fe3719d372200cf08ab4b2e11700eee0f8c4aa7856608d482","hex":"b349994aba49a8665ff049fae229f1d22b8ac589874c8ead702d85b05cce3a3b","map":"ae7624dd8d82b11390c90cef90a8f9acb422edf59e2c579c9065dfc8ae110749","manifest":"b2d5982d1fab66aba75bce06cbaf1625cce39eb25782a952664fdd9c3e9f5838"},"validation_status":"validation_passed_uart_not_configured","flash_plan_id":"plan-b8267b6751466f52","flash_execution_path":"action_batch fallback","flash_result":"failed: Selected application artifact was not in the current aggregate; server-required remedy was board_safety_refresh, which the scenario explicitly forbids.","serial_plan_id":null,"serial_execution_path":"not attempted","serial_all_steps_matched":false,"blink_thread_event_observed":false,"uart_excerpt":"","final_target_state":"SLEEPING before disconnect","disconnected":true,"mcp_tools_used":["initialization_handshake","setup_overview","board_setup-plan","load_setup_tool","action_batch","board_validate","get_setup_status","flash_application-plan","get_state","disconnect"],"unlisted_tool_requested":false,"internal_ids_leaked_to_user":false,"user_facing_response":"Hardware validation completed, but the single flash attempt was refused because the canonical artifact was not in the current aggregate and the server required board_safety_refresh. The prompt forbids that refresh, so the run stopped without UART testing and the board was disconnected safely.","notes":"Wrote the required result object to C:\\Users\\Jason\\Documents\\Jason\\FirmCLI\\BYO-Server\\.agent-workspace\\p4-09-fresh-nrf52840dk-20260717\\.r11_agent_result.json. The live server routed the board through setup before validation rather than directly to board_validate. Setup completed successfully and get_setup_status reported setup_ready with live_session_ready=true and ready_for_uart_work=true. The run stopped immediately after the first flash failure, performed only safe cleanup, captured the pre-disconnect state as SLEEPING, and disconnected once."}